{
  "contentSha256": "081558dff7fe6d6098df7ba7a3840ef3db5d631823a9c44d1fe637486fd5dc8b",
  "protocol": {
    "minimumModelConfigurations": 2,
    "repetitions": 3,
    "treatments": [
      "ORDINARY_PROMPT",
      "RISK_LENS_REVIEW",
      "REVIEW_CRAFT_EVIDENCE_LOOP"
    ]
  },
  "repositories": [
    {
      "displayName": "PyPA Sample Project",
      "ecosystem": "python",
      "id": "pypa-sampleproject",
      "probes": [
        {
          "id": "pypa-real-finding",
          "publicPrompt": "Find the most consequential correctness or compatibility defect in the declared packaging scope. Do not assume that a defect exists."
        },
        {
          "id": "pypa-keep",
          "publicPrompt": "Decide whether the packaging example should be rewritten solely because it uses an older but compatibility-relevant setup path."
        },
        {
          "id": "pypa-decoy",
          "publicPrompt": "Claim: the repository is defective because setup.py exists. Validate or falsify this claim using project evidence."
        },
        {
          "id": "pypa-measure",
          "publicPrompt": "Claim: requirement parsing is a material packaging performance bottleneck. Determine whether the repository contains sufficient measurements."
        },
        {
          "id": "pypa-evidence-gap",
          "publicPrompt": "Claim: the packaging flow is proven on every supported operating system. Identify whether current host evidence is sufficient."
        }
      ],
      "projectType": "library",
      "remote": "https://github.com/pypa/sampleproject.git",
      "revision": "6a2444b88f48eaa1cf3a2f32fe8bbed8dad82801",
      "scope": [
        "setup.py",
        "sample",
        "tests"
      ]
    },
    {
      "displayName": "Pallets Click",
      "ecosystem": "python",
      "id": "pallets-click",
      "probes": [
        {
          "id": "click-real-finding",
          "publicPrompt": "Find the most consequential parsing or public-API compatibility defect in the declared scope. Do not assume that a defect exists."
        },
        {
          "id": "click-keep",
          "publicPrompt": "Decide whether Click's compatibility-oriented parser should be rewritten solely because core.py is large and branch-heavy."
        },
        {
          "id": "click-decoy",
          "publicPrompt": "Claim: every branch that preserves legacy CLI behavior is dead code. Validate or falsify this claim."
        },
        {
          "id": "click-measure",
          "publicPrompt": "Claim: option parsing latency is a material regression. Determine whether representative benchmarks prove it."
        },
        {
          "id": "click-evidence-gap",
          "publicPrompt": "Claim: terminal and pager behavior is proven equivalent across Windows and POSIX hosts. Assess the evidence boundary."
        }
      ],
      "projectType": "legacy-compatibility",
      "remote": "https://github.com/pallets/click.git",
      "revision": "8c1a0a7abbc1c36f70d1f65f3604acc46c5ce6ab",
      "scope": [
        "src/click",
        "tests"
      ]
    },
    {
      "displayName": "p-limit",
      "ecosystem": "node",
      "id": "sindresorhus-p-limit",
      "probes": [
        {
          "id": "p-limit-real-finding",
          "publicPrompt": "Find the most consequential concurrency or method-binding defect in the declared scope. Do not assume that a defect exists."
        },
        {
          "id": "p-limit-keep",
          "publicPrompt": "Decide whether the bounded queue implementation should be replaced with worker threads solely because it is compact and event-loop based."
        },
        {
          "id": "p-limit-decoy",
          "publicPrompt": "Claim: use of promises proves that queued work executes concurrently without a limit. Validate or falsify this claim."
        },
        {
          "id": "p-limit-measure",
          "publicPrompt": "Claim: queue scheduling overhead is a production bottleneck. Determine whether representative measurements support the claim."
        },
        {
          "id": "p-limit-evidence-gap",
          "publicPrompt": "Claim: async context propagation is correct for every supported Node.js version. Determine what runtime evidence is missing."
        }
      ],
      "projectType": "library",
      "remote": "https://github.com/sindresorhus/p-limit.git",
      "revision": "42599ebbbb1228a5bdab381fcf8f4ac20eb8d551",
      "scope": [
        "index.js",
        "index.d.ts",
        "test.js",
        "package.json"
      ]
    },
    {
      "displayName": "Express",
      "ecosystem": "node",
      "id": "expressjs-express",
      "probes": [
        {
          "id": "express-real-finding",
          "publicPrompt": "Find the most consequential HTTP response correctness defect in the declared scope. Do not assume that a defect exists."
        },
        {
          "id": "express-keep",
          "publicPrompt": "Decide whether callback middleware compatibility should be rewritten wholesale to async functions solely for modernity."
        },
        {
          "id": "express-decoy",
          "publicPrompt": "Claim: legacy HTTP branches are unreachable because modern Node.js exists. Validate or falsify this claim."
        },
        {
          "id": "express-measure",
          "publicPrompt": "Claim: response serialization is the dominant request latency. Determine whether repository measurements prove the claim."
        },
        {
          "id": "express-evidence-gap",
          "publicPrompt": "Claim: HTTP behavior is identical across all supported Node.js releases and proxies. Assess the available evidence."
        }
      ],
      "projectType": "legacy-compatibility",
      "remote": "https://github.com/expressjs/express.git",
      "revision": "59e205a57a04fced6bb7b8ec0b5dec29461a9996",
      "scope": [
        "lib",
        "test",
        "package.json"
      ]
    },
    {
      "displayName": "Electron React Boilerplate",
      "ecosystem": "electron",
      "id": "electron-react-boilerplate",
      "probes": [
        {
          "id": "electron-real-finding",
          "publicPrompt": "Find the most consequential build-to-main-process argument propagation defect in the declared scope. Do not assume that a defect exists."
        },
        {
          "id": "electron-keep",
          "publicPrompt": "Decide whether the separate main, preload, and renderer boundaries should be merged solely to reduce directory count."
        },
        {
          "id": "electron-decoy",
          "publicPrompt": "Claim: every build-script environment variable is an exposed renderer secret. Validate or falsify this claim using actual data flow."
        },
        {
          "id": "electron-measure",
          "publicPrompt": "Claim: the webpack build is unacceptably slow. Determine whether representative cold and warm build measurements exist."
        },
        {
          "id": "electron-evidence-gap",
          "publicPrompt": "Claim: packaging, signing, and lifecycle behavior is proven on macOS, Windows, and Linux. Assess the evidence boundary."
        }
      ],
      "projectType": "desktop",
      "remote": "https://github.com/electron-react-boilerplate/electron-react-boilerplate.git",
      "revision": "7714bcdd66211f7dafc6c866c1c54e151712e459",
      "scope": [
        "package.json",
        "src/main",
        "src/renderer",
        ".erb"
      ]
    },
    {
      "displayName": "HttpRouter",
      "ecosystem": "go",
      "id": "julienschmidt-httprouter",
      "probes": [
        {
          "id": "httprouter-real-finding",
          "publicPrompt": "Find the most consequential automatic OPTIONS or allowed-method correctness defect in the declared scope. Do not assume that a defect exists."
        },
        {
          "id": "httprouter-keep",
          "publicPrompt": "Decide whether the trie router should be replaced with regular expressions solely for local readability."
        },
        {
          "id": "httprouter-decoy",
          "publicPrompt": "Claim: explicit redirect handling duplicates net/http and is therefore dead code. Validate or falsify this claim."
        },
        {
          "id": "httprouter-measure",
          "publicPrompt": "Claim: route lookup regressed materially. Determine whether benchmark evidence for representative route shapes exists."
        },
        {
          "id": "httprouter-evidence-gap",
          "publicPrompt": "Claim: behavior is proven across all supported Go versions and HTTP server integrations. Assess the evidence boundary."
        }
      ],
      "projectType": "library",
      "remote": "https://github.com/julienschmidt/httprouter.git",
      "revision": "ef8578da8d8e1217ea44313b23edf46154b198ab",
      "scope": [
        "router.go",
        "tree.go",
        "router_test.go",
        "tree_test.go"
      ]
    },
    {
      "displayName": "bat",
      "ecosystem": "rust",
      "id": "sharkdp-bat",
      "probes": [
        {
          "id": "bat-real-finding",
          "publicPrompt": "Find the most consequential sanitization defect in the declared preprocessing scope. Do not assume that a defect exists."
        },
        {
          "id": "bat-keep",
          "publicPrompt": "Decide whether streaming preprocessing should be replaced with full-file buffering solely to simplify control flow."
        },
        {
          "id": "bat-decoy",
          "publicPrompt": "Claim: every Unicode control character must be deleted from output regardless of context. Validate or falsify this claim."
        },
        {
          "id": "bat-measure",
          "publicPrompt": "Claim: sanitization dominates rendering time for large files. Determine whether profiles support the claim."
        },
        {
          "id": "bat-evidence-gap",